{"dataset":"generated","fixtures":[{"away":"NTG","date":"2026-08-15","home":"AUR","id":"m_showcase","insights":49,"kickoff":"17:30","matchup":true,"matchweek":1,"patterns":7,"score":[4,0],"status":"live"},{"away":"VES","date":"2026-08-15","home":"HAR","id":"m_001","insights":43,"kickoff":"12:30","matchup":true,"matchweek":1,"patterns":5,"score":[1,2],"status":"final"},{"away":"AUR","date":"2026-08-15","home":"NTG","id":"m_002","insights":40,"kickoff":"15:00","matchup":true,"matchweek":1,"patterns":2,"score":[0,1],"status":"final"},{"away":"NTG","date":"2026-08-21","home":"VES","id":"m_004","insights":38,"kickoff":"20:00","matchup":true,"matchweek":2,"patterns":3,"score":[1,2],"status":"final"},{"away":"CAL","date":"2026-08-23","home":"AUR","id":"m_003","insights":47,"kickoff":"14:00","matchup":true,"matchweek":2,"patterns":0,"score":[1,3],"status":"final"},{"away":"HAR","date":"2026-08-29","home":"NTG","id":"m_005","insights":43,"kickoff":"12:30","matchup":true,"matchweek":3,"patterns":2,"score":[2,2],"status":"final"},{"away":"VES","date":"2026-08-29","home":"CAL","id":"m_006","insights":42,"kickoff":"15:00","matchup":true,"matchweek":3,"patterns":3,"score":[4,1],"status":"final"},{"away":"CAL","date":"2026-09-04","home":"HAR","id":"m_008","insights":44,"kickoff":"20:00","matchup":true,"matchweek":4,"patterns":5,"score":[0,2],"status":"final"},{"away":"AUR","date":"2026-09-05","home":"VES","id":"m_007","insights":35,"kickoff":"15:00","matchup":false,"matchweek":4,"patterns":0,"score":[1,1],"status":"final"},{"away":"NTG","date":"2026-09-12","home":"CAL","id":"m_009","insights":39,"kickoff":"15:00","matchup":true,"matchweek":5,"patterns":2,"score":[3,0],"status":"final"},{"away":"HAR","date":"2026-09-12","home":"AUR","id":"m_010","insights":46,"kickoff":"15:00","matchup":true,"matchweek":5,"patterns":4,"score":[1,3],"status":"final"},{"away":"NTG","date":"2026-09-18","home":"AUR","id":"m_012","insights":41,"kickoff":"20:00","matchup":true,"matchweek":6,"patterns":1,"score":[0,0],"status":"final"},{"away":"HAR","date":"2026-09-20","home":"VES","id":"m_011","insights":43,"kickoff":"14:00","matchup":true,"matchweek":6,"patterns":2,"score":[2,2],"status":"final"},{"away":"AUR","date":"2026-09-26","home":"CAL","id":"m_013","insights":43,"kickoff":"15:00","matchup":true,"matchweek":7,"patterns":2,"score":[2,0],"status":"final"},{"away":"VES","date":"2026-09-27","home":"NTG","id":"m_014","insights":38,"kickoff":"14:00","matchup":true,"matchweek":7,"patterns":1,"score":[2,1],"status":"final"},{"away":"CAL","date":"2026-10-04","home":"VES","id":"m_016","insights":39,"kickoff":"14:00","matchup":true,"matchweek":8,"patterns":2,"score":[2,2],"status":"final"},{"away":"NTG","date":"2026-10-04","home":"HAR","id":"m_015","insights":36,"kickoff":"16:30","matchup":true,"matchweek":8,"patterns":0,"score":[0,4],"status":"final"},{"away":"HAR","date":"2026-10-09","home":"CAL","id":"m_018","insights":42,"kickoff":"20:00","matchup":true,"matchweek":9,"patterns":2,"score":[6,1],"status":"final"},{"away":"VES","date":"2026-10-10","home":"AUR","id":"m_017","insights":40,"kickoff":"15:00","matchup":false,"matchweek":9,"patterns":1,"score":[1,1],"status":"final"},{"away":"CAL","date":"2026-10-17","home":"NTG","id":"m_019","insights":38,"kickoff":"15:00","matchup":true,"matchweek":10,"patterns":0,"score":[1,0],"status":"final"},{"away":"AUR","date":"2026-10-18","home":"HAR","id":"m_020","insights":41,"kickoff":"16:30","matchup":true,"matchweek":10,"patterns":1,"score":[1,1],"status":"final"},{"away":"VES","date":"2026-10-23","home":"NTG","id":"m_022","insights":39,"kickoff":"20:00","matchup":true,"matchweek":11,"patterns":3,"score":[0,2],"status":"final"},{"away":"HAR","date":"2026-10-24","home":"CAL","id":"m_021","insights":38,"kickoff":"15:00","matchup":true,"matchweek":11,"patterns":3,"score":[8,0],"status":"final"},{"away":"NTG","date":"2026-10-30","home":"HAR","id":"m_024","insights":45,"kickoff":"20:00","matchup":true,"matchweek":12,"patterns":0,"score":[0,3],"status":"final"},{"away":"AUR","date":"2026-10-31","home":"VES","id":"m_023","insights":36,"kickoff":"15:00","matchup":false,"matchweek":12,"patterns":5,"score":[1,0],"status":"final"},{"away":"CAL","date":"2026-11-07","home":"NTG","id":"m_025","insights":40,"kickoff":"15:00","matchup":true,"matchweek":13,"patterns":2,"score":[1,2],"status":"final"},{"away":"HAR","date":"2026-11-07","home":"AUR","id":"m_026","insights":38,"kickoff":"15:00","matchup":true,"matchweek":13,"patterns":1,"score":[4,1],"status":"final"},{"away":"AUR","date":"2026-11-14","home":"CAL","id":"m_028","insights":46,"kickoff":"12:30","matchup":true,"matchweek":14,"patterns":6,"score":[4,0],"status":"final"},{"away":"VES","date":"2026-11-15","home":"HAR","id":"m_027","insights":42,"kickoff":"14:00","matchup":true,"matchweek":14,"patterns":1,"score":[1,1],"status":"final"},{"away":"NTG","date":"2026-11-20","home":"AUR","id":"m_029","insights":40,"kickoff":"20:00","matchup":true,"matchweek":15,"patterns":3,"score":[3,4],"status":"final"},{"away":"CAL","date":"2026-11-21","home":"VES","id":"m_030","insights":41,"kickoff":"15:00","matchup":true,"matchweek":15,"patterns":5,"score":[1,1],"status":"final"},{"away":"CAL","date":"2026-11-28","home":"HAR","id":"m_031","insights":44,"kickoff":"15:00","matchup":true,"matchweek":16,"patterns":2,"score":[2,5],"status":"final"},{"away":"NTG","date":"2026-11-28","home":"VES","id":"m_032","insights":43,"kickoff":"17:30","matchup":true,"matchweek":16,"patterns":2,"score":[0,0],"status":"final"},{"away":"VES","date":"2026-12-05","home":"AUR","id":"m_033","insights":36,"kickoff":"12:30","matchup":false,"matchweek":17,"patterns":5,"score":[1,2],"status":"final"},{"away":"HAR","date":"2026-12-05","home":"NTG","id":"m_034","insights":45,"kickoff":"12:30","matchup":true,"matchweek":17,"patterns":3,"score":[1,4],"status":"final"},{"away":"NTG","date":"2026-12-12","home":"CAL","id":"m_035","insights":44,"kickoff":"17:30","matchup":true,"matchweek":18,"patterns":5,"score":[3,1],"status":"final"},{"away":"AUR","date":"2026-12-13","home":"HAR","id":"m_036","insights":39,"kickoff":"14:00","matchup":true,"matchweek":18,"patterns":1,"score":[0,0],"status":"final"},{"away":"CAL","date":"2026-12-19","home":"AUR","id":"m_038","insights":38,"kickoff":"15:00","matchup":true,"matchweek":19,"patterns":2,"score":[1,4],"status":"final"},{"away":"HAR","date":"2026-12-20","home":"VES","id":"m_037","insights":46,"kickoff":"14:00","matchup":true,"matchweek":19,"patterns":0,"score":[0,1],"status":"final"},{"away":"AUR","date":"2026-12-26","home":"NTG","id":"m_039","insights":37,"kickoff":"15:00","matchup":true,"matchweek":20,"patterns":1,"score":[5,0],"status":"final"},{"away":"VES","date":"2026-12-26","home":"CAL","id":"m_040","insights":41,"kickoff":"15:00","matchup":true,"matchweek":20,"patterns":4,"score":[5,1],"status":"final"}],"heat":{"cols":24,"rows":16,"x_edges":[0.0,4.1625,8.325,12.4875,16.65,20.8125,24.975,29.1375,33.3,37.475,41.65,45.825,50.0,54.175,58.35,62.525,66.7,70.8625,75.025,79.1875,83.35,87.5125,91.675,95.8375,100.0],"y_edges":[0.0,6.6667,13.3333,20.0,26.6667,33.3333,40.0,45.0,50.0,55.0,60.0,66.6667,73.3333,80.0,86.6667,93.3333,100.0]},"teams":{"AUR":"Aurelia Rovers","CAL":"Calder Athletic","HAR":"Harbor Wanderers","NTG":"Northgate Town","VES":"Veston United"}}